{
  "$schema": "../../schema-json/deck.schema.json",
  "id": "deck.freighter_mk1",
  "name": "Freighter Mk1",
  "width": 32,
  "height": 18,
  "tiles": [
    "EEEEEEEENNNNGGGGGGQQQQQQQQQQBBBB",
    "EEEEEEEENNNNGGGGGGQQQQQQQQQQBBBB",
    "EEEEEEEENNNNGGGGGGQQQQQQQQQQBBBB",
    "EEEEEEEENNNNGGGGGGQQQQQQQQQQBBBB",
    "EEEEEEEENNNNGGGGGGQQQQQQQQQQBBBB",
    "EEEEEEEENNNNGGGGGGQQQQQQQQQQBBBB",
    "EEEEEEEENNNNGGGGGGQQQQQQQQQQBBBB",
    "EEEEEEEENNNNGGGGGGQQQQQQQQQQBBBB",
    "EEEEEEEECCCCCCCCCCCCCCCCCCCCCCCC",
    "EEEEEEEECCCCCCCCCCCCCCCCCCCCCCCC",
    "EEEEEEEEHHHHHHHHHHHHHHHHHHHHAAAA",
    "EEEEEEEEHHHHHHHHHHHHHHHHHHHHAAAA",
    "EEEEEEEEHHHHHHHHHHHHHHHHHHHHAAAA",
    "EEEEEEEEHHHHHHHHHHHHHHHHHHHHAAAA",
    "EEEEEEEEHHHHHHHHHHHHHHHHHHHHAAAA",
    "EEEEEEEEHHHHHHHHHHHHHHHHHHHHAAAA",
    "EEEEEEEEHHHHHHHHHHHHHHHHHHHHAAAA",
    "EEEEEEEEHHHHHHHHHHHHHHHHHHHHAAAA"
  ],
  "compartments": [
    {
      "key": "bridge",
      "symbol": "B",
      "name": "Bridge",
      "tags": ["bridge"]
    },
    {
      "key": "quarters",
      "symbol": "Q",
      "name": "Crew Quarters",
      "tags": ["quarters"]
    },
    {
      "key": "galley",
      "symbol": "G",
      "name": "Galley & Mess",
      "tags": ["galley", "mess"]
    },
    {
      "key": "infirmary",
      "symbol": "N",
      "name": "Infirmary",
      "tags": ["infirmary"]
    },
    {
      "key": "engineering",
      "symbol": "E",
      "name": "Engineering",
      "tags": ["engineering"]
    },
    {
      "key": "corridor",
      "symbol": "C",
      "name": "Central Corridor",
      "tags": ["corridor"]
    },
    {
      "key": "cargoHold",
      "symbol": "H",
      "name": "Cargo Hold",
      "tags": ["cargoHold"]
    },
    {
      "key": "airlock",
      "symbol": "A",
      "name": "Airlock",
      "tags": ["airlock"]
    }
  ],
  "doors": [
    {
      "key": "bridge_corridor",
      "edge": {
        "x": 29,
        "y": 8,
        "side": "n"
      },
      "kind": "interior",
      "manualOperationSupported": true,
      "initialState": "closed"
    },
    {
      "key": "personnel_ramp",
      "edge": {
        "x": 29,
        "y": 17,
        "side": "s"
      },
      "kind": "ramp",
      "powerDomain": "main",
      "manualOperationSupported": true,
      "initialState": "closed"
    },
    {
      "key": "airlock_corridor",
      "edge": {
        "x": 29,
        "y": 10,
        "side": "n"
      },
      "kind": "interior",
      "manualOperationSupported": true,
      "initialState": "closed"
    },
    {
      "key": "quarters_corridor",
      "edge": {
        "x": 23,
        "y": 8,
        "side": "n"
      },
      "kind": "interior",
      "manualOperationSupported": true,
      "initialState": "open"
    },
    {
      "key": "galley_corridor",
      "edge": {
        "x": 15,
        "y": 8,
        "side": "n"
      },
      "kind": "interior",
      "manualOperationSupported": true,
      "initialState": "open"
    },
    {
      "key": "infirmary_corridor",
      "edge": {
        "x": 10,
        "y": 8,
        "side": "n"
      },
      "kind": "interior",
      "manualOperationSupported": true,
      "initialState": "closed"
    },
    {
      "key": "cargo_corridor",
      "edge": {
        "x": 19,
        "y": 10,
        "side": "n"
      },
      "kind": "interior",
      "manualOperationSupported": true,
      "initialState": "open"
    },
    {
      "key": "engineering_corridor",
      "edge": {
        "x": 7,
        "y": 8,
        "side": "e"
      },
      "kind": "interior",
      "powerDomain": "main",
      "manualOperationSupported": true,
      "initialState": "open"
    },
    {
      "key": "engineering_cargo",
      "edge": {
        "x": 7,
        "y": 13,
        "side": "e"
      },
      "kind": "interior",
      "powerDomain": "main",
      "manualOperationSupported": true,
      "initialState": "closed"
    },
    {
      "key": "cargo_ramp",
      "edge": {
        "x": 18,
        "y": 17,
        "side": "s"
      },
      "kind": "ramp",
      "powerDomain": "main",
      "manualOperationSupported": true,
      "initialState": "closed"
    }
  ],
  "openings": [],
  "walls": [],
  "machines": [
    {
      "key": "helm_1",
      "machineDefId": "machine.helm",
      "origin": {
        "x": 30,
        "y": 3
      },
      "rotation": 0,
      "powerDomain": "main"
    },
    {
      "key": "engine_1",
      "machineDefId": "machine.engine",
      "origin": {
        "x": 6,
        "y": 2
      },
      "rotation": 180,
      "powerDomain": "main"
    },
    {
      "key": "coolant_pump_1",
      "machineDefId": "machine.coolant_pump",
      "origin": {
        "x": 6,
        "y": 5
      },
      "rotation": 180,
      "powerDomain": "main"
    },
    {
      "key": "generator_1",
      "machineDefId": "machine.generator",
      "origin": {
        "x": 6,
        "y": 7
      },
      "rotation": 180,
      "powerDomain": "main"
    },
    {
      "key": "battery_bank_1",
      "machineDefId": "machine.battery_bank",
      "origin": {
        "x": 6,
        "y": 10
      },
      "rotation": 180,
      "powerDomain": "main"
    },
    {
      "key": "life_support_1",
      "machineDefId": "machine.life_support",
      "origin": {
        "x": 6,
        "y": 13
      },
      "rotation": 180,
      "powerDomain": "main"
    },
    {
      "key": "galley_stove_1",
      "machineDefId": "machine.galley_stove",
      "origin": {
        "x": 16,
        "y": 2
      },
      "rotation": 0,
      "powerDomain": "main"
    },
    {
      "key": "medbay_bed_1",
      "machineDefId": "machine.medbay_bed",
      "origin": {
        "x": 10,
        "y": 2
      },
      "rotation": 180
    },
    {
      "key": "cargo_crane_1",
      "machineDefId": "machine.cargo_crane",
      "origin": {
        "x": 19,
        "y": 15
      },
      "rotation": 180,
      "powerDomain": "main"
    },
    {
      "key": "bunk_1",
      "machineDefId": "machine.bunk",
      "origin": {
        "x": 26,
        "y": 1
      },
      "rotation": 0
    },
    {
      "key": "bunk_2",
      "machineDefId": "machine.bunk",
      "origin": {
        "x": 25,
        "y": 1
      },
      "rotation": 0
    },
    {
      "key": "bunk_3",
      "machineDefId": "machine.bunk",
      "origin": {
        "x": 24,
        "y": 1
      },
      "rotation": 0
    },
    {
      "key": "bunk_4",
      "machineDefId": "machine.bunk",
      "origin": {
        "x": 23,
        "y": 1
      },
      "rotation": 0
    },
    {
      "key": "bunk_5",
      "machineDefId": "machine.bunk",
      "origin": {
        "x": 26,
        "y": 5
      },
      "rotation": 0
    },
    {
      "key": "bunk_6",
      "machineDefId": "machine.bunk",
      "origin": {
        "x": 25,
        "y": 5
      },
      "rotation": 0
    },
    {
      "key": "bunk_7",
      "machineDefId": "machine.bunk",
      "origin": {
        "x": 24,
        "y": 5
      },
      "rotation": 0
    },
    {
      "key": "bunk_8",
      "machineDefId": "machine.bunk",
      "origin": {
        "x": 23,
        "y": 5
      },
      "rotation": 0
    },
    {
      "key": "nav_terminal_1",
      "machineDefId": "machine.nav_terminal",
      "origin": {
        "x": 31,
        "y": 1
      },
      "rotation": 0,
      "powerDomain": "main"
    },
    {
      "key": "mess_table_1",
      "machineDefId": "machine.mess_table",
      "origin": {
        "x": 13,
        "y": 5
      },
      "rotation": 0
    },
    {
      "key": "intercom_engineering",
      "machineDefId": "machine.intercom",
      "origin": {
        "x": 0,
        "y": 0
      },
      "rotation": 0,
      "powerDomain": "main"
    },
    {
      "key": "intercom_infirmary",
      "machineDefId": "machine.intercom",
      "origin": {
        "x": 8,
        "y": 0
      },
      "rotation": 0,
      "powerDomain": "main"
    },
    {
      "key": "intercom_galley",
      "machineDefId": "machine.intercom",
      "origin": {
        "x": 12,
        "y": 7
      },
      "rotation": 180,
      "powerDomain": "main"
    },
    {
      "key": "intercom_quarters",
      "machineDefId": "machine.intercom",
      "origin": {
        "x": 18,
        "y": 0
      },
      "rotation": 0,
      "powerDomain": "main"
    },
    {
      "key": "intercom_bridge",
      "machineDefId": "machine.intercom",
      "origin": {
        "x": 28,
        "y": 7
      },
      "rotation": 180,
      "powerDomain": "main"
    },
    {
      "key": "intercom_corridor",
      "machineDefId": "machine.intercom",
      "origin": {
        "x": 31,
        "y": 8
      },
      "rotation": 0,
      "powerDomain": "main"
    },
    {
      "key": "intercom_cargo_hold",
      "machineDefId": "machine.intercom",
      "origin": {
        "x": 8,
        "y": 10
      },
      "rotation": 0,
      "powerDomain": "main"
    },
    {
      "key": "intercom_airlock",
      "machineDefId": "machine.intercom",
      "origin": {
        "x": 31,
        "y": 10
      },
      "rotation": 0,
      "powerDomain": "main"
    }
  ],
  "powerDomains": [
    {
      "key": "main",
      "name": "Main Bus"
    }
  ],
  "zones": [
    {
      "key": "cargo_stow",
      "name": "Cargo Stowage",
      "tags": ["cargoStowage"],
      "tiles": [
        {
          "x": 23,
          "y": 12
        },
        {
          "x": 22,
          "y": 12
        },
        {
          "x": 21,
          "y": 12
        },
        {
          "x": 20,
          "y": 12
        },
        {
          "x": 19,
          "y": 12
        },
        {
          "x": 18,
          "y": 12
        },
        {
          "x": 17,
          "y": 12
        },
        {
          "x": 16,
          "y": 12
        },
        {
          "x": 15,
          "y": 12
        },
        {
          "x": 14,
          "y": 12
        },
        {
          "x": 13,
          "y": 12
        },
        {
          "x": 23,
          "y": 13